{
  "$schema": "https://json-schema.org/draft/2020-12/schema",
  "$id": "urn:moirae:accord-02r5:schema:validation-rules:0.1",
  "rule_profile_id": "urn:moirae:accord-02r5:validation-rules:0.1",
  "rule_profile_version": "0.1",
  "record_type": "VALIDATION_RULE_PROFILE",
  "base_rule_registry": {"path":"accord-02r3-validation-rules.json","profile_id":"urn:moirae:accord-02r3:validation-rules:0.1","profile_version":"0.1"},
  "overlay_semantics": "The active R5 rule set is the R3 base registry plus these explicit R5 overrides and additions. No base rule is silently deleted; the R5 package is the authoritative package for this composition.",
  "overrides": [
    {"rule_id":"BND-004","replaces_classification":"UNEVALUABLE","classification":"DETERMINISTIC_WITH_PROFILE","inputs":["declared bundle scope","closed R5 specification package","schema-contract registry"],"condition":{"operator":"resolve_schema_contract","resolution_scope":"exact R5 package contract inventory","outcomes":["RESOLVED","MISSING","DUPLICATE","WRONG_TYPE","STRUCTURALLY_INVALID","UNSUPPORTED_VERSION"]},"failure_code":"ACCORD-02R5-SCHEMA-CONTRACT-RESOLUTION-FAILURE","depends_on":["PKG-001","PKG-002","SCHEMA-001","SCHEMA-002"],"produces":["SCHEMA_CONTRACT_RESOLVED"]},
    {"rule_id":"BND-005","replaces_classification":"UNEVALUABLE","classification":"DETERMINISTIC_WITH_PROFILE","inputs":["active profile references","closed R5 specification package","profile-contract inventory"],"condition":{"operator":"resolve_active_profiles","resolution_scope":"exact R5 package profile inventory","outcomes":["RESOLVED","MISSING","DUPLICATE","WRONG_PROFILE_TYPE","UNSUPPORTED_VERSION","STRUCTURALLY_INVALID"]},"failure_code":"ACCORD-02R5-ACTIVE-PROFILE-RESOLUTION-FAILURE","depends_on":["PKG-001","PKG-002","PROF-001","PROF-002"],"produces":["ACTIVE_PROFILES_RESOLVED"]},
    {"rule_id":"DIGEST-001","replaces_classification":"DETERMINISTIC_WITH_PROFILE","classification":"DETERMINISTIC_WITH_PROFILE","inputs":["typed reference","resolved record","resolved schema contract","supplied content digest","exact R5 canonicalization profile"],"condition":{"operator":"canonical_content_digest_matches","algorithm":"SHA-256","canonicalization":"resolved ACCORD-02R5 RFC8785_JCS profile","content_target":"content","profile_required_when_digest_supplied":true},"failure_code":"ACCORD-02R5-DIGEST-MISMATCH","depends_on":["BND-004","DIGEST-CANON-001","DIGEST-CANON-002","DIGEST-CANON-003"],"produces":["DIGEST_VALID"]}
  ],
  "rules": [
    {"rule_id":"PKG-001","category":"SPECIFICATION_PACKAGE","classification":"DETERMINISTIC_WITH_PROFILE","inputs":["specification_package_ref","closed R5 package manifest"],"condition":{"operator":"exact_package_resolves","no_fallback":true,"exact_version_required":true},"failure_code":"ACCORD-02R5-PACKAGE-MISSING-OR-MISMATCH","severity":"BLOCKING","required_for":["structural admission","verifier admission","experiment-run admission","scoring admission"],"depends_on":[],"produces":["SPEC_PACKAGE_RESOLVED"]},
    {"rule_id":"PKG-002","category":"SPECIFICATION_PACKAGE","classification":"DETERMINISTIC_WITH_PROFILE","inputs":["package schema/profile/rule/canonicalization inventories"],"condition":{"operator":"contract_inventory_closed_and_unique","active_source_schema_coverage_required":true},"failure_code":"ACCORD-02R5-PACKAGE-CONTRACT-DUPLICATE-OR-DANGLING","severity":"BLOCKING","required_for":["structural admission","verifier admission","experiment-run admission","scoring admission"],"depends_on":["PKG-001"],"produces":["PACKAGE_CONTRACTS_CLOSED"]},
    {"rule_id":"PROF-001","category":"PROFILE_RESOLUTION","classification":"DETERMINISTIC_WITH_PROFILE","inputs":["profile_type","profile_id","profile_version","R5 package profile inventory"],"condition":{"operator":"resolve_profile","outcomes":["RESOLVED","MISSING","DUPLICATE","WRONG_PROFILE_TYPE","UNSUPPORTED_VERSION","STRUCTURALLY_INVALID"],"no_latest_or_default":true},"failure_code":"ACCORD-02R5-PROFILE-RESOLUTION-FAILURE","severity":"BLOCKING","required_for":["verifier admission","experiment-run admission","scoring admission"],"depends_on":["PKG-001","PKG-002"],"produces":["ACTIVE_PROFILE_RESOLVED"]},
    {"rule_id":"PROF-002","category":"PROFILE_RESOLUTION","classification":"DETERMINISTIC","inputs":["active profile references"],"condition":{"operator":"exact_version_pinned"},"failure_code":"ACCORD-02R5-PROFILE-VERSION-UNPINNED","severity":"BLOCKING","required_for":["verifier admission","experiment-run admission","scoring admission"],"depends_on":["PROF-001"],"produces":["PROFILE_VERSIONS_PINNED"]},
    {"rule_id":"SCHEMA-001","category":"SCHEMA_CONTRACT","classification":"DETERMINISTIC_WITH_PROFILE","inputs":["record schema_id","record schema_version","R5 package schema-contract inventory"],"condition":{"operator":"resolve_schema_contract","record_type_must_be_permitted":true},"failure_code":"ACCORD-02R5-SCHEMA-CONTRACT-FAILURE","severity":"BLOCKING","required_for":["structural admission","verifier admission","experiment-run admission","scoring admission"],"depends_on":["PKG-001","PKG-002"],"produces":["SCHEMA_CONTRACT_RESOLVED"]},
    {"rule_id":"SCHEMA-002","category":"SCHEMA_CONTRACT","classification":"DETERMINISTIC_WITH_PROFILE","inputs":["record content","resolved schema contract"],"condition":{"operator":"validate_structure","outcomes":["STRUCTURE_VALID","SCHEMA_CONTRACT_MISSING","SCHEMA_VERSION_UNSUPPORTED","RECORD_SCHEMA_MISMATCH","STRUCTURALLY_INVALID"]},"failure_code":"ACCORD-02R5-STRUCTURE-VALIDATION-FAILURE","severity":"BLOCKING","required_for":["structural admission","verifier admission","experiment-run admission","scoring admission"],"depends_on":["SCHEMA-001"],"produces":["STRUCTURE_VALID"]},
    {"rule_id":"ROLE-001","category":"ROLE_VOCABULARY","classification":"DETERMINISTIC_WITH_PROFILE","inputs":["producing_role","consumer_roles","R5 package role vocabulary"],"condition":{"operator":"all_roles_in_closed_vocabulary"},"failure_code":"ACCORD-02R5-UNKNOWN-ROLE","severity":"BLOCKING","required_for":["experiment-run admission"],"depends_on":["PKG-001","PKG-002","PROF-001"],"produces":["ROLE_VOCABULARY_VALID"]},
    {"rule_id":"DIGEST-CANON-001","category":"DIGEST_CANONICALIZATION","classification":"DETERMINISTIC_WITH_PROFILE","inputs":["supplied digest","canonicalization profile reference","R5 package canonicalization inventory"],"condition":{"operator":"digest_profile_resolves_when_digest_supplied"},"failure_code":"ACCORD-02R5-CANONICALIZATION-MISSING","severity":"BLOCKING","required_for":["verifier admission","experiment-run admission","scoring admission"],"depends_on":["PKG-001","PKG-002","PROF-001","SCHEMA-001"],"produces":["CANONICALIZATION_PROFILE_RESOLVED"]},
    {"rule_id":"DIGEST-CANON-002","category":"DIGEST_CANONICALIZATION","classification":"DETERMINISTIC_WITH_PROFILE","inputs":["resolved canonicalization profile","concrete record schema_id/version","concrete record_type","container type"],"condition":{"operator":"profile_admits_concrete_record_form","content_target":"content"},"failure_code":"ACCORD-02R5-CANONICALIZATION-INCOMPATIBLE","severity":"BLOCKING","required_for":["verifier admission","experiment-run admission","scoring admission"],"depends_on":["DIGEST-CANON-001","SCHEMA-001"],"produces":["CANONICALIZATION_APPLICABLE"]},
    {"rule_id":"DIGEST-CANON-003","category":"DIGEST_CANONICALIZATION","classification":"DETERMINISTIC_WITH_PROFILE","inputs":["canonicalization profile","algorithm and method fields"],"condition":{"operator":"algorithm_and_method_supported","algorithm":"SHA-256","method":"RFC8785_JCS","encoding":"UTF-8"},"failure_code":"ACCORD-02R5-CANONICALIZATION-UNSUPPORTED","severity":"BLOCKING","required_for":["verifier admission","experiment-run admission","scoring admission"],"depends_on":["DIGEST-CANON-001"],"produces":["CANONICALIZATION_SUPPORTED"]},
    {"rule_id":"SCENARIO-ID-001","category":"SCENARIO_ID_POLICY","classification":"DETERMINISTIC_WITH_PROFILE","inputs":["scenario_id policy","classifier feature profile","verifier decision profile"],"condition":{"operator":"correlation_only_and_non_semantic","forbidden_uses":["BASELINE_DECISION","CLASSIFIER_FEATURE","VERIFIER_DECISION"]},"failure_code":"ACCORD-02R5-SCENARIO-ID-SEMANTIC-USE","severity":"MAJOR","required_for":["experiment-run admission","scoring admission"],"depends_on":["PROF-001","CLF-001"],"produces":["SCENARIO_ID_NON_SEMANTIC"]}
  ],
  "active_rule_count": 82,
  "classification_gate": {"acceptance_critical_ambiguous":0,"acceptance_critical_unevaluable":0,"acceptance_critical_contradictory":0}
}
